{
  "actor": {
    "id": "root-controller",
    "kind": "agent"
  },
  "exit_code": null,
  "finished_at": "2026-07-19T18:24:59.378781Z",
  "id": "RUN-01KXXQKEA1P9CCF7PBE0HB1TBZ",
  "independence_level": "L0",
  "runtime": {
    "branch": "codex/v6-alpha-pilot-ready",
    "execution_context_id": "alpha-review-repairs-999b694",
    "model": "gpt-5.6-sol",
    "profile": "local-multi",
    "provider": "openai",
    "worktree": "C:\\Users\\hanxian.chen\\.codex\\visualizations\\2026\\07\\19\\019f7b03-224c-7fa0-a030-fd771e2b008e\\worktrees\\v6-alpha-pilot-ready"
  },
  "schema_version": 1,
  "started_at": "2026-07-19T17:43:22.689512Z",
  "status": "cancelled",
  "task_id": "TASK-01KXXHKS63XE2A30229824FX0N-v6-alpha-pilot-ready",
  "work_unit_id": "WU-01KXXQJNPW1BHBSSN49TGMT6EH"
}
