{
  "actor": {
    "id": "core-implementer",
    "kind": "agent"
  },
  "exit_code": 0,
  "finished_at": "2026-07-19T16:45:00Z",
  "id": "RUN-01KXXHVRGKP9ZR7N4BGZGXG4CC",
  "independence_level": "L0",
  "runtime": {
    "execution_context_id": "core-blocker-impl-20260719",
    "profile": "local-multi"
  },
  "schema_version": 1,
  "started_at": "2026-07-19T16:03:03.828949Z",
  "status": "succeeded",
  "task_id": "TASK-01KXXHKS63XE2A30229824FX0N-v6-alpha-pilot-ready",
  "work_unit_id": "WU-01KXXHSZRPJ5YKMQ9MCQHQZH11"
}
