{
  "actor": {
    "id": "edge-implementer",
    "kind": "agent"
  },
  "exit_code": 0,
  "finished_at": "2026-07-19T16:48:00Z",
  "id": "RUN-01KXXHVSJXA7X1PRGWJBKP35BC",
  "independence_level": "L0",
  "runtime": {
    "execution_context_id": "edge-blocker-impl-20260719",
    "profile": "local-multi"
  },
  "schema_version": 1,
  "started_at": "2026-07-19T16:03:04.925122Z",
  "status": "succeeded",
  "task_id": "TASK-01KXXHKS63XE2A30229824FX0N-v6-alpha-pilot-ready",
  "work_unit_id": "WU-01KXXHTEMXPCT29MAV3AFAMWFH"
}
