{
  "actor": {
    "id": "devex-implementer",
    "kind": "agent"
  },
  "exit_code": 0,
  "finished_at": "2026-07-19T16:50:00Z",
  "id": "RUN-01KXXHVTRV1J0RFJZC931C47V2",
  "independence_level": "L0",
  "runtime": {
    "execution_context_id": "devex-blocker-impl-20260719",
    "profile": "local-multi"
  },
  "schema_version": 1,
  "started_at": "2026-07-19T16:03:06.139424Z",
  "status": "succeeded",
  "task_id": "TASK-01KXXHKS63XE2A30229824FX0N-v6-alpha-pilot-ready",
  "work_unit_id": "WU-01KXXHTR2PNYB2M57BQTRFXC2A"
}
